"SA-13","1","0","Trustworthiness","The organization requires that the information system meets [ Assignment: organization-defined level of trustworthiness ].","The intent of this control is to ensure that organizations recognize the importance of trustworthiness and making explicit trustworthiness decisions when designing, developing, and implementing organizational information systems. Trustworthiness is a char","1","493","1"
"SA-14","0","0","Critical Information System Components","The organization: Determines [ Assignment: organization-defined list of critical information system components that require re-implementation ]; and Re-implements or custom develops such information system components.","The underlying assumption is that the list of information technology products defined by the organization cannot be trusted due to threats from the supply chain that the organization finds unacceptable. The organization re-implements or custom develops su","0","494","1"
"SC-1","3","0","System and Communications Protection Policy and Procedures","The organization develops, disseminates, and reviews/updates [ Assignment: organization-defined frequency ]: A formal, documented system and communications protection policy that addresses purpose, scope, roles, responsibilities, management commitment, co","This control is intended to produce the policy and procedures that are required for the effective implementation of selected security controls and control enhancements in the system and communications protection family. The policy and procedures are consi","1","496","1"
"SC-2","2","0","Application Partitioning","The information system separates user functionality (including user interface services) from information system management functionality.","Information system management functionality includes, for example, functions necessary to administer databases, network components, workstations, or servers, and typically requires privileged user access. The separation of user functionality from informat","1","497","1"
"SC-3","1","0","Security Function Isolation","The information system isolates security functions from nonsecurity functions.","The information system isolates security functions from nonsecurity functions by means of an isolation boundary (implemented via partitions and domains) that controls access to and protects the integrity of, the hardware, software, and firmware that perfo","1","499","1"
"SC-4","2","0","Information In Shared Resources","The information system prevents unauthorized and unintended information transfer via shared system resources.","The purpose of this control is to prevent information, including encrypted representations of information, produced by the actions of a prior user/role (or the actions of a process acting on behalf of a prior user/role) from being available to any current","1","505","1"
"SC-5","3","0","Denial of Service Protection","The information system protects against or limits the effects of the following types of denial of service attacks: [ Assignment: organization-defined list of types of denial of service attacks or reference to source for current list ].","A variety of technologies exist to limit, or in some cases, eliminate the effects of denial of service attacks. For example, boundary protection devices can filter certain types of packets to protect devices on an organizations internal network from being","1","507","1"
"SC-6","0","0","Resource Priority","The information system limits the use of resources by priority.","Priority protection helps prevent a lower-priority process from delaying or interfering with the information system servicing any higher-priority process. This control does not apply to components in the information system for which there is only a single","0","510","1"
"SC-7","3","0","Boundary Protection","The information system: Monitors and controls communications at the external boundary of the system and at key internal boundaries within the system; and Connects to external networks or information systems only through managed interfaces consisting of bo","Restricting external web traffic only to organizational web servers within managed interfaces and prohibiting external traffic that appears to be spoofing an internal address as the source are examples of restricting and prohibiting communications. Manage","1","511","1"
"SC-8","2","0","Transmission Integrity","The information system protects the integrity of transmitted information.","This control applies to communications across internal and external networks. If the organization is relying on a commercial service provider for transmission services as a commodity item rather than a fully dedicated service, it may be more difficult to ","1","530","1"
"SC-9","2","0","Transmission Confidentiality","The information system protects the confidentiality of transmitted information.","This control applies to communications across internal and external networks. If the organization is relying on a commercial service provider for transmission services as a commodity item rather than a fully dedicated service, it may be more difficult to ","1","533","1"
"SC-10","2","0","Network Disconnect","The information system terminates the network connection associated with a communications session at the end of the session or after [ Assignment: organization-defined time period ] of inactivity.","This control applies to both internal and external networks. Terminating network connections associated with communications sessions include, for example, de-allocating associated TCP/IP address/port pairs at the operating-system level, or de-allocating n","2","536","1"
"SC-11","0","0","Trusted Path","The information system establishes a trusted communications path between the user and the following security functions of the system: [ Assignment: organization-defined security functions to include at a minimum, information system authentication and reau","A trusted path is employed for high-confidence connections between the security functions of the information system and the user (e.g., for login).","0","537","1"
"SC-12","3","0","Cryptographic Key Establishment and Management","The organization establishes and manages cryptographic keys for required cryptography employed within the information system.","Cryptographic key management and establishment can be performed using manual procedures or automated mechanisms with supporting manual procedures. In addition to being required for the effective operation of a cryptographic mechanism, effective cryptograp","1","538","1"
"SC-13","3","0","Use of Cryptography","The information system implements required cryptographic protections using cryptographic modules that comply with applicable federal laws, Executive Orders, directives, policies, regulations, standards, and guidance.","None.","1","544","1"
"SC-14","3","0","Public Access Protections","The information system protects the integrity and availability of publicly available information and applications.","The purpose of this control is to ensure that organizations explicitly address the protection needs for public information and applications with such protection likely being implemented as part of other security controls.","1","549","1"
"SC-15","3","0","Collaborative Computing Devices","The information system: Prohibits remote activation of collaborative computing devices with the following exceptions: [ Assignment: organization-defined exceptions where remote activation is to be allowed ]; and Provides an explicit indication of use to u","Collaborative computing devices include, for example, networked white boards, cameras, and microphones. Explicit indication of use includes, for example, signals to users when collaborative computing devices are activated.","1","550","1"
"SC-16","0","0","Transmission of Security Attributes","The information system associates security attributes with information exchanged between information systems.","Security attributes may be explicitly or implicitly associated with the information contained within the information system. Related control: AC-16.","0","554","1"
"SC-17","2","0","Public Key Infrastructure Certificates","The organization issues public key certificates under an [ Assignment: organization-defined certificate policy ] or obtains public key certificates under an appropriate certificate policy from an approved service provider.","For user certificates, each organization attains certificates from an approved, shared service provider, as required by OMB policy. For federal agencies operating a legacy public key infrastructure cross-certified with the Federal Bridge Certification Aut","1","556","1"
"SC-18","2","0","Mobile Code","The organization: Defines acceptable and unacceptable mobile code and mobile code technologies; Establishes usage restrictions and implementation guidance for acceptable mobile code and mobile code technologies; and Authorizes, monitors, and controls the ","Decisions regarding the employment of mobile code within organizational information systems are based on the potential for the code to cause damage to the system if used maliciously. Mobile code technologies include, for example, Java, JavaScript, ActiveX","1","557","1"
"SC-19","2","0","Voice Over Internet Protocol","The organization: Establishes usage restrictions and implementation guidance for Voice over Internet Protocol (VoIP) technologies based on the potential to cause damage to the information system if used maliciously; and Authorizes, monitors, and controls ","None.","1","562","1"
"SC-20","3","0","Secure Name / Address Resolution Service (Authoritative Source)","The information system provides additional data origin and integrity artifacts along with the authoritative data the system returns in response to name/address resolution queries.","This control enables remote clients to obtain origin authentication and integrity verification assurances for the host/service name to network address resolution information obtained through the service. A domain name system (DNS) server is an example of ","1","563","1"
"SC-21","1","0","Secure Name / Address Resolution Service (Recursive Or Caching Resolver)","The information system performs data origin authentication and data integrity verification on the name/address resolution responses the system receives from authoritative sources when requested by client systems.","A recursive resolving or caching domain name system (DNS) server is an example of an information system that provides name/address resolution service for local clients. Authoritative DNS servers are examples of authoritative sources. Information systems t","1","565","1"
"SC-22","2","0","Architecture and Provisioning for Name / Address Resolution Service","The information systems that collectively provide name/address resolution service for an organization are fault-tolerant and implement internal/external role separation.","A domain name system (DNS) server is an example of an information system that provides name/address resolution service. To eliminate single points of failure and to enhance redundancy, there are typically at least two authoritative domain name system (DNS","1","567","1"
"SC-23","2","0","Session Authenticity","The information system provides mechanisms to protect the authenticity of communications sessions.","This control focuses on communications protection at the session, versus packet, level. The intent of this control is to establish grounds for confidence at each end of a communications session in the ongoing identity of the other party and in the validit","1","568","1"
"SC-24","1","0","Fail In Known State","The information system fails to a [ Assignment: organization-defined known-state ] for [ Assignment: organization-defined types of failures ] preserving [ Assignment: organization-defined system state information ] in failure.","Failure in a known state can address safety or security in accordance with the mission/business needs of the organization. Failure in a known secure state helps prevent a loss of confidentiality, integrity, or availability in the event of a failure of the","1","573","1"
"SC-25","0","0","Thin Nodes","The information system employs processing components that have minimal functionality and information storage.","The deployment of information system components with minimal functionality (e.g., diskless nodes and thin client technologies) reduces the need to secure every user endpoint, and may reduce the exposure of information, information systems, and services to","0","574","1"
"SC-26","0","0","Honeypots","The information system includes components specifically designed to be the target of malicious attacks for the purpose of detecting, deflecting, and analyzing such attacks.","None.","0","575","1"
"SC-27","0","0","Operating System-independent Applications","The information system includes: [ Assignment: organization-defined operating system-independent applications ].","Operating system-independent applications are applications that can run on multiple operating systems. Such applications promote portability and reconstitution on different platform architectures, increasing the availability for critical functionality wit","0","577","1"
"SC-28","2","0","Protection of Information At Rest","The information system protects the confidentiality and integrity of information at rest.","This control is intended to address the confidentiality and integrity of information at rest in nonmobile devices and covers user information and system information. Information at rest refers to the state of information when it is located on a secondary ","1","578","1"
"SC-29","0","0","Heterogeneity","The organization employs diverse information technologies in the implementation of the information system.","Increasing the diversity of information technologies within the information system reduces the impact of the exploitation of a specific technology. Organizations that select this control should consider that an increase in diversity may add complexity and","0","580","1"
"SC-30","0","0","Virtualization Techniques","The organization employs virtualization techniques to present information system components as other types of components, or components with differing configurations.","Virtualization techniques provide organizations with the ability to disguise information systems, potentially reducing the likelihood of successful attacks without the cost of having multiple platforms.","0","581","1"
"SC-31","0","0","Covert Channel Analysis","The organization requires that information system developers/integrators perform a covert channel analysis to identify those aspects of system communication that are potential avenues for covert storage and timing channels.","Information system developers/integrators are in the best position to identify potential avenues within the system that might lead to covert channels. Covert channel analysis is a meaningful activity when there is the potential for unauthorized informatio","0","584","1"
"SC-32","2","0","Information System Partitioning","The organization partitions the information system into components residing in separate physical domains (or environments) as deemed necessary.","Information system partitioning is a part of a defense-in-depth protection strategy. An organizational assessment of risk guides the partitioning of information system components into separate physical domains (or environments). The security categorizatio","1","586","1"
"SC-33","0","0","Transmission Preparation Integrity","The information system protects the integrity of information during the processes of data aggregation, packaging, and transformation in preparation for transmission.","Information can be subjected to unauthorized changes (e.g., malicious and/or unintentional modification) at information aggregation or protocol transformation points.","0","587","1"
"SC-34","0","0","Non-modifiable Executable Programs","The information system at [ Assignment: organization-defined information system components ]: Loads and executes the operating environment from hardware-enforced, read-only media; and Loads and executes [ Assignment: organization-defined applications ] fr","In this control, the term operating environment is defined as the code upon which applications are hosted, for example, a monitor, executive, operating system, or application running directly on the hardware platform. Hardware-enforced, read-only media in","0","588","1"
"SI-1","3","0","System and Information Integrity Policy and Procedures","The organization develops, disseminates, and reviews/updates [ Assignment: organization-defined frequency ]: A formal, documented system and information integrity policy that addresses purpose, scope, roles, responsibilities, management commitment, coordi","This control is intended to produce the policy and procedures that are required for the effective implementation of selected security controls and control enhancements in the system and information integrity family. The policy and procedures are consisten","1","591","1"
"SI-2","3","0","Flaw Remediation","The organization: Identifies, reports, and corrects information system flaws; Tests software updates related to flaw remediation for effectiveness and potential side effects on organizational information systems before installation; and Incorporates flaw ","The organization identifies information systems containing software affected by recently announced software flaws (and potential vulnerabilities resulting from those flaws) and reports this information to designated organizational officials with informati","1","592","1"
"SI-3","3","0","Malicious Code Protection","The organization: Employs malicious code protection mechanisms at information system entry and exit points and at workstations, servers, or mobile computing devices on the network to detect and eradicate malicious code: - Transported by electronic mail, e","Information system entry and exit points include, for example, firewalls, electronic mail servers, web servers, proxy servers, and remote-access servers. Malicious code includes, for example, viruses, worms, Trojan horses, and spyware. Malicious code can ","1","597","1"
"SI-4","2","0","Information System Monitoring","The organization: Monitors events on the information system in accordance with [ Assignment: organization-defined monitoring objectives ] and detects information system attacks; Identifies unauthorized use of the information system; Deploys monitoring dev","Information system monitoring includes external and internal monitoring. External monitoring includes the observation of events occurring at the system boundary (i.e., part of perimeter defense and boundary protection). Internal monitoring includes the ob","1","604","1"
"SI-5","3","0","Security Alerts, Advisories, and Directives","The organization: Receives information system security alerts, advisories, and directives from designated external organizations on an ongoing basis; Generates internal security alerts, advisories, and directives as deemed necessary; Disseminates security","Security alerts and advisories are generated by the United States Computer Emergency Readiness Team (US-CERT) to maintain situational awareness across the federal government. Security directives are issued by OMB or other designated organizations with the","1","622","1"
"SI-6","1","0","Security Functionality Verification","The information system verifies the correct operation of security functions [ Selection (one or more): [ Assignment: organization-defined system transitional states ] ; upon command by user with appropriate privilege; periodically every [ Assignment: orga","The need to verify security functionality applies to all security functions. For those security functions that are not able to execute automated self-tests, the organization either implements compensating security controls or explicitly accepts the risk o","1","624","1"
"SI-7","2","0","Software and Information Integrity","The information system detects unauthorized changes to software and information.","The organization employs integrity verification applications on the information system to look for evidence of information tampering, errors, and omissions. The organization employs good software engineering practices with regard to commercial off-the-she","1","628","1"
"SI-8","2","0","Spam Protection","The organization: Employs spam protection mechanisms at information system entry and exit points and at workstations, servers, or mobile computing devices on the network to detect and take action on unsolicited messages transported by electronic mail, ele","Information system entry and exit points include, for example, firewalls, electronic mail servers, web servers, proxy servers, and remote-access servers. Related controls: SC-5, SI-3.","1","633","1"
"SI-9","2","0","Information Input Restrictions","The organization restricts the capability to input information to the information system to authorized personnel.","Restrictions on organizational personnel authorized to input information to the information system may extend beyond the typical access controls employed by the system and include limitations based on specific operational/project responsibilities. Related","2","636","1"
"SI-10","2","0","Information Input Validation","The information system checks the validity of information inputs.","Rules for checking the valid syntax and semantics of information system inputs (e.g., character set, length, numerical range, acceptable values) are in place to verify that inputs match specified definitions for format and content. Inputs passed to interp","1","637","1"
"SI-11","2","0","Error Handling","The information system: Identifies potentially security-relevant error conditions; Generates error messages that provide information necessary for corrective actions without revealing [ Assignment: organization-defined sensitive or potentially harmful inf","The structure and content of error messages are carefully considered by the organization. The extent to which the information system is able to identify and handle error conditions is guided by organizational policy and operational requirements. Sensitive","2","638","1"
"SI-12","3","0","Information Output Handling and Retention","The organization handles and retains both information within and output from the information system in accordance with applicable federal laws, Executive Orders, directives, policies, regulations, standards, and operational requirements.","The output handling and retention requirements cover the full life cycle of the information, in some cases extending beyond the disposal of the information system. The National Archives and Records Administration provides guidance on records retention. Re","2","639","1"
"SI-13","0","0","Predictable Failure Prevention","The organization: Protects the information system from harm by considering mean time to failure for [ Assignment: organization-defined list of information system components ] in specific environments of operation; and Provides substitute information syste","While mean time to failure is primarily a reliability issue, this control focuses on the potential failure of specific components of the information system that provide security capability. Mean time to failure rates are defendable and based on considerat","0","640","1"
