"PE-10","2","0","Emergency Shutoff","The organization: Provides the capability of shutting off power to the information system or individual system components in emergency situations; Places emergency shutoff switches or devices in [ Assignment: organization-defined location by information s","This control applies to facilities containing concentrations of information system resources, for example, data centers, server rooms, and mainframe computer rooms.","1","368","1"
"PE-11","2","0","Emergency Power","The organization provides a short-term uninterruptible power supply to facilitate an orderly shutdown of the information system in the event of a primary power source loss.","This control, to include any enhancements specified, may be satisfied by similar requirements fulfilled by another organizational entity other than the information security program. Organizations avoid duplicating actions already covered.","1","370","1"
"PE-12","3","0","Emergency Lighting","The organization employs and maintains automatic emergency lighting for the information system that activates in the event of a power outage or disruption and that covers emergency exits and evacuation routes within the facility.","This control, to include any enhancements specified, may be satisfied by similar requirements fulfilled by another organizational entity other than the information security program. Organizations avoid duplicating actions already covered.","1","373","1"
"PE-13","3","0","Fire Protection","The organization employs and maintains fire suppression and detection devices/systems for the information system that are supported by an independent energy source.","Fire suppression and detection devices/systems include, for example, sprinkler systems, handheld fire extinguishers, fixed fire hoses, and smoke detectors. This control, to include any enhancements specified, may be satisfied by similar requirements fulfi","1","375","1"
"PE-14","3","0","Temperature and Humidity Controls","The organization: Maintains temperature and humidity levels within the facility where the information system resides at [ Assignment: organization-defined acceptable levels ]; and Monitors temperature and humidity levels [ Assignment: organization-defined","This control, to include any enhancements specified, may be satisfied by similar requirements fulfilled by another organizational entity other than the information security program. Organizations avoid duplicating actions already covered.","1","380","1"
"PE-15","3","0","Water Damage Protection","The organization protects the information system from damage resulting from water leakage by providing master shutoff valves that are accessible, working properly, and known to key personnel.","This control, to include any enhancements specified, may be satisfied by similar requirements fulfilled by another organizational entity other than the information security program. Organizations avoid duplicating actions already covered.","1","383","1"
"PE-16","3","0","Delivery and Removal","The organization authorizes, monitors, and controls [ Assignment: organization-defined types of information system components ] entering and exiting the facility and maintains records of those items.","Effectively enforcing authorizations for entry and exit of information system components may require restricting access to delivery areas and possibly isolating the areas from the information system and media libraries.","1","385","1"
"PE-17","2","0","Alternate Work Site","The organization: Employs [ Assignment: organization-defined management, operational, and technical information system security controls ] at alternate work sites; Assesses as feasible, the effectiveness of security controls at alternate work sites; and P","Alternate work sites may include, for example, government facilities or private residences of employees. The organization may define different sets of security controls for specific alternate work sites or types of sites.","1","386","1"
"PE-18","2","0","Location of Information System Components","The organization positions information system components within the facility to minimize potential damage from physical and environmental hazards and to minimize the opportunity for unauthorized access.","Physical and environmental hazards include, for example, flooding, fire, tornados, earthquakes, hurricanes, acts of terrorism, vandalism, electromagnetic pulse, electrical interference, and electromagnetic radiation. Whenever possible, the organization al","2","387","1"
"PE-19","0","0","Information Leakage","The organization protects the information system from information leakage due to electromagnetic signals emanations.","The security categorization of the information system (with respect to confidentiality) and organizational security policy guides the application of safeguards and countermeasures employed to protect the information system against information leakage due ","0","389","1"
"PL-1","3","0","Security Planning Policy and Procedures","The organization develops, disseminates, and reviews/updates [ Assignment: organization-defined frequency ]: A formal, documented security planning policy that addresses purpose, scope, roles, responsibilities, management commitment, coordination among or","This control is intended to produce the policy and procedures that are required for the effective implementation of selected security controls and control enhancements in the security planning family. The policy and procedures are consistent with applicab","1","391","1"
"PL-2","3","0","System Security Plan","The organization: Develops a security plan for the information system that: - Is consistent with the organizations enterprise architecture; - Explicitly defines the authorization boundary for the system; - Describes the operational context of the informat","The security plan contains sufficient information (including specification of parameters for assignment and selection statements in security controls either explicitly or by reference) to enable an implementation that is unambiguously compliant with the i","1","392","1"
"PL-3","0","1","System Security Plan Update","Withdrawn: Incorporated into PL-2 ].",\N,\N,"395","1"
"PL-4","3","0","Rules of Behavior","The organization: Establishes and makes readily available to all information system users, the rules that describe their responsibilities and expected behavior with regard to information and information system usage; and Receives signed acknowledgment fro","The organization considers different sets of rules based on user roles and responsibilities, for example, differentiating between the rules that apply to privileged users and rules that apply to general users. Electronic signatures are acceptable for use ","1","396","1"
"PL-5","3","0","Privacy Impact Assessment","The organization conducts a privacy impact assessment on the information system in accordance with OMB policy.","None.","1","398","1"
"PL-6","2","0","Security-related Activity Planning","The organization plans and coordinates security-related activities affecting the information system before conducting such activities in order to reduce the impact on organizational operations (i.e., mission, functions, image, and reputation), organizatio","Security-related activities include, for example, security assessments, audits, system hardware and software maintenance, and contingency plan testing/exercises. Organizational advance planning and coordination includes both emergency and nonemergency (i.","3","399","1"
"PS-1","3","0","Personnel Security Policy and Procedures","The organization develops, disseminates, and reviews/updates [ Assignment: organization-defined frequency ]: A formal, documented personnel security policy that addresses purpose, scope, roles, responsibilities, management commitment, coordination among o","This control is intended to produce the policy and procedures that are required for the effective implementation of selected security controls and control enhancements in the personnel security family. The policy and procedures are consistent with applica","1","400","1"
"PS-2","3","0","Position Categorization","The organization: Assigns a risk designation to all positions; Establishes screening criteria for individuals filling those positions; and Reviews and revises position risk designations [ Assignment: organization-defined frequency ].","Position risk designations are consistent with Office of Personnel Management policy and guidance. The screening criteria include explicit information security role appointment requirements (e.g., training, security clearance).","1","401","1"
"PS-3","3","0","Personnel Screening","The organization: Screens individuals prior to authorizing access to the information system; and Rescreens individuals according to [ Assignment: organization-defined list of conditions requiring rescreening and, where re-screening is so indicated, the fr","Screening and rescreening are consistent with applicable federal laws, Executive Orders, directives, policies, regulations, standards, guidance, and the criteria established for the risk designation of the assigned position. The organization may define di","1","402","1"
"PS-4","3","0","Personnel Termination","The organization, upon termination of individual employment: Terminates information system access; Conducts exit interviews; Retrieves all security-related organizational information system-related property; and Retains access to organizational informatio","Information system-related property includes, for example, hardware authentication tokens, system administration technical manuals, keys, identification cards, and building passes. Exit interviews ensure that individuals understand any security constraint","2","405","1"
"PS-5","3","0","Personnel Transfer","The organization reviews logical and physical access authorizations to information systems/facilities when personnel are reassigned or transferred to other positions within the organization and initiates [ Assignment: organization-defined transfer or reas","This control applies when the reassignment or transfer of an employee is permanent or of such an extended duration as to make the actions warranted. In addition the organization defines the actions appropriate for the type of reassignment or transfer; whe","2","406","1"
"PS-6","3","0","Access Agreements","The organization: Ensures that individuals requiring access to organizational information and information systems sign appropriate access agreements prior to being granted access; and Reviews/updates the access agreements [ Assignment: organization-define","Access agreements include, for example, nondisclosure agreements, acceptable use agreements, rules of behavior, and conflict-of-interest agreements. Signed access agreements include an acknowledgement that individuals have read, understand, and agree to a","3","407","1"
"PS-7","3","0","Third-party Personnel Security","The organization: Establishes personnel security requirements including security roles and responsibilities for third-party providers; Documents personnel security requirements; and Monitors provider compliance.","Third-party providers include, for example, service bureaus, contractors, and other organizations providing information system development, information technology services, outsourced applications, and network and security management. The organization exp","1","410","1"
"PS-8","3","0","Personnel Sanctions","The organization employs a formal sanctions process for personnel failing to comply with established information security policies and procedures.","The sanctions process is consistent with applicable federal laws, Executive Orders, directives, policies, regulations, standards, and guidance. The process is described in access agreements and can be included as part of the general personnel policies and","3","411","1"
"RA-1","3","0","Risk Assessment Policy and Procedures","The organization develops, disseminates, and reviews/updates [ Assignment: organization-defined frequency ]: A formal, documented risk assessment policy that addresses purpose, scope, roles, responsibilities, management commitment, coordination among orga","This control is intended to produce the policy and procedures that are required for the effective implementation of selected security controls and control enhancements in the risk assessment family. The policy and procedures are consistent with applicable","1","412","1"
"RA-2","3","0","Security Categorization","The organization: Categorizes information and the information system in accordance with applicable federal laws, Executive Orders, directives, policies, regulations, standards, and guidance; Documents the security categorization results (including support","A clearly defined authorization boundary is a prerequisite for an effective security categorization. Security categorization describes the potential adverse impacts to organizational operations, organizational assets, and individuals should the informatio","1","413","1"
"RA-3","3","0","Risk Assessment","The organization: Conducts an assessment of risk, including the likelihood and magnitude of harm, from the unauthorized access, use, disclosure, disruption, modification, or destruction of the information system and the information it processes, stores, o","A clearly defined authorization boundary is a prerequisite for an effective risk assessment. Risk assessments take into account vulnerabilities, threat sources, and security controls planned or in place to determine the level of residual risk posed to org","1","414","1"
"RA-4","0","1","Risk Assessment Update"," Withdrawn: Incorporated into RA-3 ].",\N,\N,"415","1"
"RA-5","3","0","Vulnerability Scanning","The organization: Scans for vulnerabilities in the information system and hosted applications [ Assignment: organization-defined frequency and/or randomly in accordance with organization-defined process ] and when new vulnerabilities potentially affecting","The security categorization of the information system guides the frequency and comprehensiveness of the vulnerability scans. Vulnerability analysis for custom software and applications may require additional, more specialized techniques and approaches (e.","1","416","1"
"SA-1","3","0","System and Services Acquisition Policy and Procedures","The organization develops, disseminates, and reviews/updates [ Assignment: organization-defined frequency ]: A formal, documented system and services acquisition policy that includes information security considerations and that addresses purpose, scope, r","This control is intended to produce the policy and procedures that are required for the effective implementation of selected security controls and control enhancements in the system and services acquisition family. The policy and procedures are consistent","1","426","1"
"SA-2","3","0","Allocation of Resources","The organization: Includes a determination of information security requirements for the information system in mission/business process planning; Determines, documents, and allocates the resources required to protect the information system as part of its c","Related controls: PM-3, PM-11.","1","427","1"
"SA-3","3","0","Life Cycle Support","The organization: Manages the information system using a system development life cycle methodology that includes information security considerations; Defines and documents information system security roles and responsibilities throughout the system develo","Related control: PM-7.","1","428","1"
"SA-4","3","0","Acquisitions","The organization includes the following requirements and/or specifications, explicitly or by reference, in information system acquisition contracts based on an assessment of risk and in accordance with applicable federal laws, Executive Orders, directives","The acquisition documents for information systems, information system components, and information system services include, either explicitly or by reference, security requirements that describe: (i) required security capabilities (i.e., security needs and","1","429","1"
"SA-5","3","0","Information System Documentation","The organization: Obtains, protects as required, and makes available to authorized personnel, administrator documentation for the information system that describes: Secure configuration, installation, and operation of the information system; Effective use","The inability of the organization to obtain necessary information system documentation may occur, for example, due to the age of the system and/or lack of support from the vendor/contractor. In those situations, organizations may need to recreate selected","2","437","1"
"SA-6","3","0","Software Usage Restrictions","The organization: Uses software and associated documentation in accordance with contract agreements and copyright laws; Employs tracking systems for software and associated documentation protected by quantity licenses to control copying and distribution; ","Tracking systems can include, for example, simple spreadsheets or fully automated, specialized applications depending on the needs of the organization.","1","443","1"
"SA-7","3","0","User-installed Software","The organization enforces explicit rules governing the installation of software by users.","If provided the necessary privileges, users have the ability to install software. The organization identifies what types of software installations are permitted (e.g., updates and security patches to existing software) and what types of installations are ","1","444","1"
"SA-8","2","0","Security Engineering Principles","The organization applies information system security engineering principles in the specification, design, development, implementation, and modification of the information system.","The application of security engineering principles is primarily targeted at new development information systems or systems undergoing major upgrades and is integrated into the system development life cycle. For legacy information systems, the organization","1","445","1"
"SA-9","3","0","External Information System Services","The organization: Requires that providers of external information system services comply with organizational information security requirements and employ appropriate security controls in accordance with applicable federal laws, Executive Orders, directive","An external information system service is a service that is implemented outside of the authorization boundary of the organizational information system (i.e., a service that is used by, but not a part of, the organizational information system). Relationshi","1","446","1"
"SA-10","2","0","Developer Configuration Management","The organization requires that information system developers/integrators: Perform configuration management during information system design, development, implementation, and operation; Manage and control changes to the information system; Implement only o","Related controls: CM-3, CM-4, CM-9.","1","448","1"
"SA-11","2","0","Developer Security Testing","The organization requires that information system developers/integrators, in consultation with associated security personnel (including security engineers): Create and implement a security test and evaluation plan; Implement a verifiable flaw remediation ","Developmental security test results are used to the greatest extent feasible after verification of the results and recognizing that these results are impacted whenever there have been security-relevant modifications to the information system subsequent to","2","451","1"
"SA-12","1","0","Supply Chain Protection","The organization protects against supply chain threats by employing: [ Assignment: organization-defined list of measures to protect against supply chain threats ] as part of a comprehensive, defense-in-breadth information security strategy.","A defense-in-breadth approach helps to protect information systems (including the information technology products that compose those systems) throughout the system development life cycle (i.e., during design and development, manufacturing, packaging, asse","1","455","1"
"PM-1","-1","0","Information Security Program Plan","The organization: Develops and disseminates an organization-wide information security program plan that: - Provides an overview of the requirements for the security program and a description of the security program management controls and common controls ","The information security program plan can be represented in a single document or compilation of documents at the discretion of the organization. The plan documents the organization-wide program management controls and organization-defined common controls.","1","460","1"
"PM-2","-1","0","Senior Information Security Officer","The organization appoints a senior information security officer with the mission and resources to coordinate, develop, implement, and maintain an organization-wide information security program.","The security officer described in this control is an organizational official. For a federal agency (as defined in applicable federal laws, Executive Orders, directives, policies, or regulations) this official is the Senior Agency Information Security Offi","1","461","1"
"PM-3","-1","0","Information Security Resources","The organization: Ensures that all capital planning and investment requests include the resources needed to implement the information security program and documents all exceptions to this requirement; Employs a business case/Exhibit 300/Exhibit 53 to reco","Organizations may designate and empower an Investment Review Board (or similar group) to manage and provide oversight for the information security-related aspects of the capital planning and investment control process. Related controls: PM-4, SA-2.","1","462","1"
"PM-4","-1","0","Plan of Action and Milestones Process","The organization implements a process for ensuring that plans of action and milestones for the security program and the associated organizational information systems are maintained and document the remedial information security actions to mitigate risk to","The plan of action and milestones is a key document in the information security program and is subject to federal reporting requirements established by OMB. The plan of action and milestones updates are based on the findings from security control assessme","1","463","1"
"PM-5","-1","0","Information System Inventory","The organization develops and maintains an inventory of its information systems.","This control addresses the inventory requirements in FISMA. OMB provides guidance on developing information systems inventories and associated reporting requirements.","1","464","1"
"PM-6","-1","0","Information Security Measures of Performance","The organization develops, monitors, and reports on the results of information security measures of performance.","Measures of performance are outcome-based metrics used by an organization to measure the effectiveness or efficiency of the information security program and the security controls employed in support of the program.","1","465","1"
"PM-7","-1","0","Enterprise Architecture","The organization develops an enterprise architecture with consideration for information security and the resulting risk to organizational operations, organizational assets, individuals, other organizations, and the Nation.","The enterprise architecture developed by the organization is aligned with the Federal Enterprise Architecture. The integration of information security requirements and associated security controls into the organizations enterprise architecture helps to en","1","466","1"
"PM-8","-1","0","Critical Infrastructure Plan","The organization addresses information security issues in the development, documentation, and updating of a critical infrastructure and key resources protection plan.","The requirement and guidance for defining critical infrastructure and key resources and for preparing an associated critical infrastructure protection plan are found in applicable federal laws, Executive Orders, directives, policies, regulations, standard","1","467","1"
"PM-9","-1","0","Risk Management Strategy","The organization: Develops a comprehensive strategy to manage risk to organizational operations and assets, individuals, other organizations, and the Nation associated with the operation and use of information systems; and Implements that strategy consist","An organization-wide risk management strategy includes, for example, an unambiguous expression of the risk tolerance for the organization, acceptable risk assessment methodologies, risk mitigation strategies, a process for consistently evaluating risk acr","1","468","1"
"PM-10","-1","0","Security Authorization Process","The organization: Manages (i.e., documents, tracks, and reports) the security state of organizational information systems through security authorization processes; Designates individuals to fulfill specific roles and responsibilities within the organizati","The security authorization process for information systems requires the implementation of the Risk Management Framework and the employment of associated security standards and guidelines. Specific roles within the risk management process include a designa","1","469","1"
"PM-11","-1","0","Mission/business Process Definition","The organization: Defines mission/business processes with consideration for information security and the resulting risk to organizational operations, organizational assets, individuals, other organizations, and the Nation; and Determines information prote","Information protection needs are technology-independent, required capabilities to counter threats to organizations, individuals, or the Nation through the compromise of information (i.e., loss of confidentiality, integrity, or availability). Information p","1","470","1"
