"AC-1","3","0","Access Control Policy and Procedures","The organization develops, disseminates, and reviews/updates [ Assignment: organization-defined frequency ]: A formal, documented access control policy that addresses purpose, scope, roles, responsibilities, management commitment, coordination among organ","This control is intended to produce the policy and procedures that are required for the effective implementation of selected security controls and control enhancements in the access control family. The policy and procedures are consistent with applicable ","1","1","1"
"AC-2","3","0","Account Management","The organization manages information system accounts, including: Identifying account types (i.e., individual, group, system, application, guest/anonymous, and temporary); Establishing conditions for group membership; Identifying authorized users of the in","The identification of authorized users of the information system and the specification of access privileges is consistent with the requirements in other security controls in the security plan. Users requiring administrative privileges on information syste","1","2","1"
"AC-3","3","0","Access Enforcement","The information system enforces approved authorizations for logical access to the system in accordance with applicable policy.","Access control policies (e.g., identity-based policies, role-based policies, attribute-based policies) and access enforcement mechanisms (e.g., access control lists, access control matrices, cryptography) are employed by organizations to control access be","1","10","1"
"AC-4","2","0","Information Flow Enforcement","The information system enforces approved authorizations for controlling the flow of information within the system and between interconnected systems in accordance with applicable policy.","Information flow control regulates where information is allowed to travel within an information system and between information systems (as opposed to who is allowed to access the information) and without explicit regard to subsequent accesses to that info","1","17","1"
"AC-5","2","0","Separation of Duties","The organization: Separates duties of individuals as necessary, to prevent malevolent activity without collusion; Documents separation of duties; and Implements separation of duties through assigned information system access authorizations.","Examples of separation of duties include: (i) mission functions and distinct information system support functions are divided among different individuals/roles; (ii) different individuals perform information system support functions (e.g., system manageme","1","35","1"
"AC-6","2","0","Least Privilege","The organization employs the concept of least privilege, allowing only authorized accesses for users (and processes acting on behalf of users) which are necessary to accomplish assigned tasks in accordance with organizational missions and business functio","The access authorizations defined in this control are largely implemented by control AC-3. The organization employs the concept of least privilege for specific duties and information systems (including specific ports, protocols, and services) in accordanc","1","36","1"
"AC-7","3","0","Unsuccessful Login Attempts","The information system: Enforces a limit of [ Assignment: organization-defined number ] consecutive invalid login attempts by a user during a [ Assignment: organization-defined time period ]; and Automatically [ Selection: locks the account/node for an [ ","Due to the potential for denial of service, automatic lockouts initiated by the information system are usually temporary and automatically release after a predetermined time period established by the organization. If a delay algorithm is selected, the org","2","43","1"
"AC-8","3","0","System Use Notification","The information system: Displays an approved system use notification message or banner before granting access to the system that provides privacy and security notices consistent with applicable federal laws, Executive Orders, directives, policies, regulat","System use notification messages can be implemented in the form of warning banners displayed when individuals log in to the information system. System use notification is intended only for information system access that includes an interactive login inter","1","46","1"
"AC-9","0","0","Previous Logon (Access) Notification","The information system notifies the user, upon successful logon (access), of the date and time of the last logon (access).","This control is intended to cover both traditional logons to information systems and general accesses to information systems that occur in other types of architectural configurations (e.g., service oriented architectures).","0","47","1"
"AC-10","1","0","Concurrent Session Control","The information system limits the number of concurrent sessions for each system account to [ Assignment: organization-defined number ].","The organization may define the maximum number of concurrent sessions for an information system account globally, by account type, by account, or a combination. This control addresses concurrent sessions for a given information system account and does not","2","51","1"
"AC-11","2","0","Session Lock","The information system: Prevents further access to the system by initiating a session lock after [ Assignment: organization-defined time period ] of inactivity or upon receiving a request from a user; and Retains the session lock until the user reestablis","A session lock is a temporary action taken when a user stops work and moves away from the immediate physical vicinity of the information system but does not want to log out because of the temporary nature of the absence. The session lock is implemented at","3","52","1"
"AC-12","0","1","Session Termination"," Withdrawn: Incorporated into SC-10 ].",\N,\N,"54","1"
"AC-13","0","1","Supervision and Review Access Control"," Withdrawn: Incorporated into AC-2 and AU-6 ].",\N,\N,"55","1"
"AC-14","3","0","Permitted Actions Without Identification Or Authentication","The organization: Identifies specific user actions that can be performed on the information system without identification or authentication; and Documents and provides supporting rationale in the security plan for the information system, user actions not ","This control is intended for those specific instances where an organization determines that no identification and authentication is required; it is not, however, mandating that such instances exist in given information system. The organization may allow a","1","56","1"
"AC-15","0","1","Automated Marking"," Withdrawn: Incorporated into MP-3 ].",\N,\N,"58","1"
"AC-16","0","0","Security Attributes","The information system supports and maintains the binding of [ Assignment: organization-defined security attributes ] to information in storage, in process, and in transmission.","Security attributes are abstractions representing the basic properties or characteristics of an entity (e.g., subjects and objects) with respect to safeguarding information. These attributes are typically associated with internal data structures (e.g., re","0","59","1"
"AC-17","3","0","Remote Access","The organization: Documents allowed methods of remote access to the information system; Establishes usage restrictions and implementation guidance for each allowed remote access method; Monitors for unauthorized remote access to the information system; Au","This control requires explicit authorization prior to allowing remote access to an information system without specifying a specific format for that authorization. For example, while the organization may deem it appropriate to use a system interconnection ","1","65","1"
"AC-18","3","0","Wireless Access","The organization: Establishes usage restrictions and implementation guidance for wireless access; Monitors for unauthorized wireless access to the information system; Authorizes wireless access to the information system prior to connection; and Enforces r","Wireless technologies include, but are not limited to, microwave, satellite, packet radio (UHF/VHF), 802.11x, and Bluetooth. Wireless networks use authentication protocols (e.g., EAP/TLS, PEAP), which provide credential protection and mutual authenticatio","1","74","1"
"AC-19","3","0","Access Control for Mobile Devices","The organization: Establishes usage restrictions and implementation guidance for organization-controlled mobile devices; Authorizes connection of mobile devices meeting organizational usage restrictions and implementation guidance to organizational inform","Mobile devices include portable storage media (e.g., USB memory sticks, external hard disk drives) and portable computing and communications devices with information storage capability (e.g., notebook/laptop computers, personal digital assistants, cellula","1","80","1"
"AC-20","3","0","Use of External Information Systems","The organization establishes terms and conditions, consistent with any trust relationships established with other organizations owning, operating, and/or maintaining external information systems, allowing authorized individuals to: Access the information ","External information systems are information systems or components of information systems that are outside of the authorization boundary established by the organization and for which the organization typically has no direct supervision and authority over ","1","85","1"
"AC-21","0","0","User-based Collaboration and Information Sharing","The organization: Facilitates information sharing by enabling authorized users to determine whether access authorizations assigned to the sharing partner match the access restrictions on the information for [ Assignment: organization-defined information s","The control applies to information that may be restricted in some manner (e.g., privileged medical, contract-sensitive, proprietary, personally identifiable information, special access programs/compartments) based on some formal or administrative determin","0","88","1"
"AC-22","3","0","Publicly Accessible Content","The organization: Designates individuals authorized to post information onto an organizational information system that is publicly accessible; Trains authorized individuals to ensure that publicly accessible information does not contain nonpublic informat","Nonpublic information is any information for which the general public is not authorized access in accordance with federal laws, Executive Orders, directives, policies, regulations, standards, or guidance. Information protected under the Privacy Act and ve","2","90","1"
"AT-1","3","0","Security Awareness and Training Policy and Procedures","The organization develops, disseminates, and reviews/updates [ Assignment: organization-defined frequency ]: A formal, documented security awareness and training policy that addresses purpose, scope, roles, responsibilities, management commitment, coordin","This control is intended to produce the policy and procedures that are required for the effective implementation of selected security controls and control enhancements in the security awareness and training family. The policy and procedures are consistent","1","91","1"
"AT-2","3","0","Security Awareness","The organization provides basic security awareness training to all information system users (including managers, senior executives, and contractors) as part of initial training for new users, when required by system changes, and [ Assignment: organization","The organization determines the appropriate content of security awareness training and security awareness techniques based on the specific requirements of the organization and the information systems to which personnel have authorized access. The content ","1","92","1"
"AT-3","3","0","Security Training","The organization provides role-based security-related training: (i) before authorizing access to the system or performing assigned duties; (ii) when required by system changes; and (iii) [ Assignment: organization-defined frequency ] thereafter.","The organization determines the appropriate content of security training based on assigned roles and responsibilities and the specific requirements of the organization and the information systems to which personnel have authorized access. In addition, the","1","94","1"
"AT-4","3","0","Security Training Records","The organization: Documents and monitors individual information system security training activities including basic security awareness training and specific information system security training; and Retains individual training records for [ Assignment: or","While an organization may deem that organizationally mandated individual training programs and the development of individual training plans are necessary, this control does not mandate either. Documentation for specialized training may be maintained by in","3","97","1"
"AT-5","0","0","Contacts With Security Groups and Associations","The organization establishes and institutionalizes contact with selected groups and associations within the security community: - To facilitate ongoing security education and training for organizational personnel; - To stay up to date with the latest reco","Ongoing contact with security groups and associations is of paramount importance in an environment of rapid technology changes and dynamic threats. Security groups and associations can include, for example, special interest groups, specialized forums, pro","0","98","1"
"AU-1","3","0","Audit and Accountability Policy and Procedures","The organization develops, disseminates, and reviews/updates [ Assignment: organization-defined frequency ]: A formal, documented audit and accountability policy that addresses purpose, scope, roles, responsibilities, management commitment, coordination a","This control is intended to produce the policy and procedures that are required for the effective implementation of selected security controls and control enhancements in the audit and accountability family. The policy and procedures are consistent with a","1","99","1"
"AU-2","3","0","Auditable Events","The organization: Determines, based on a risk assessment and mission/business needs, that the information system must be capable of auditing the following events: [ Assignment: organization-defined list of auditable events ]; Coordinates the security audi","The purpose of this control is for the organization to identify events which need to be auditable as significant and relevant to the security of the information system; giving an overall system requirement in order to meet ongoing and specific audit needs","1","100","1"
"AU-3","3","0","Content of Audit Records","The information system produces audit records that contain sufficient information to, at a minimum, establish what type of event occurred, when (date and time) the event occurred, where the event occurred, the source of the event, the outcome (success or ","Audit record content that may be necessary to satisfy the requirement of this control, includes, for example, time stamps, source and destination addresses, user/process identifiers, event descriptions, success/fail indications, filenames involved, and ac","1","105","1"
"AU-4","3","0","Audit Storage Capacity","The organization allocates audit record storage capacity and configures auditing to reduce the likelihood of such capacity being exceeded.","The organization considers the types of auditing to be performed and the audit processing requirements when allocating audit storage capacity. Related controls: AU-2, AU-5, AU-6, AU-7, SI-4.","1","108","1"
"AU-5","3","0","Response To Audit Processing Failures","The information system: Alerts designated organizational officials in the event of an audit processing failure; and Takes the following additional actions: [ Assignment: organization-defined actions to be taken (e.g., shut down information system, overwri","Audit processing failures include, for example, software/hardware errors, failures in the audit capturing mechanisms, and audit storage capacity being reached or exceeded. Related control: AU-4.","1","109","1"
"AU-6","3","0","Audit Review, Analysis, and Reporting","The organization: Reviews and analyzes information system audit records [ Assignment: organization-defined frequency ] for indications of inappropriate or unusual activity, and reports findings to designated organizational officials; and Adjusts the level","Related control: AU-7.","1","114","1"
"AU-7","2","0","Audit Reduction and Report Generation","The information system provides an audit reduction and report generation capability.","An audit reduction and report generation capability provides support for near real-time audit review, analysis, and reporting requirements described in AU-6 and after-the-fact investigations of security incidents. Audit reduction and reporting tools do no","2","124","1"
"AU-8","3","0","Time Stamps","The information system uses internal system clocks to generate time stamps for audit records.","Time stamps generated by the information system include both date and time. The time may be expressed in Coordinated Universal Time (UTC), a modern continuation of Greenwich Mean Time (GMT), or local time with an offset from UTC. Related control: AU-3.","1","126","1"
"AU-9","3","0","Protection of Audit Information","The information system protects audit information and audit tools from unauthorized access, modification, and deletion.","Audit information includes all information (e.g., audit records, audit settings, and audit reports) needed to successfully audit information system activity. Related controls: AC-3, AC-6.","1","128","1"
"AU-10","1","0","Non-repudiation","The information system protects against an individual falsely denying having performed a particular action.","Examples of particular actions taken by individuals include creating information, sending a message, approving information (e.g., indicating concurrence or signing a contract), and receiving a message. Non-repudiation protects individuals against later cl","1","133","1"
"AU-11","3","0","Audit Record Retention","The organization retains audit records for [ Assignment: organization-defined time period consistent with records retention policy ] to provide support for after-the-fact investigations of security incidents and to meet regulatory and organizational infor","The organization retains audit records until it is determined that they are no longer needed for administrative, legal, audit, or other operational purposes. This includes, for example, retention and availability of audit records relative to Freedom of In","3","139","1"
"AU-12","3","0","Audit Generation","The information system: Provides audit record generation capability for the list of auditable events defined in AU-2 at [ Assignment: organization-defined information system components ]; Allows designated organizational personnel to select which auditabl","Audits records can be generated from various components within the information system. The list of audited events is the set of events for which audits are to be generated. This set of events is typically a subset of the list of all events for which the s","1","140","1"
"AU-13","0","0","Monitoring for Information Disclosure","The organization monitors open source information for evidence of unauthorized exfiltration or disclosure of organizational information [ Assignment: organization-defined frequency ].","None.","0","143","1"
"AU-14","0","0","Session Audit","The information system provides the capability to: Capture/record and log all content related to a user session; and Remotely view/hear all content related to an established user session in real time.","Session auditing activities are developed, integrated, and used in consultation with legal counsel in accordance with applicable federal laws, Executive Orders, directives, policies, or regulations.","0","144","1"
"CA-1","3","0","Security Assessment and Authorization Policies and Procedures","The organization develops, disseminates, and reviews/updates [ Assignment: organization-defined frequency ]: Formal, documented security assessment and authorization policies that address purpose, scope, roles, responsibilities, management commitment, coo","This control is intended to produce the policy and procedures that are required for the effective implementation of selected security controls and control enhancements in the security assessment and authorization family. The policies and procedures are co","1","146","1"
"CA-2","3","0","Security Assessments","The organization: Develops a security assessment plan that describes the scope of the assessment including: Security controls and control enhancements under assessment; Assessment procedures to be used to determine security control effectiveness; and Asse","The organization assesses the security controls in an information system as part of: (i) security authorization or reauthorization; (ii) meeting the FISMA requirement for annual assessments; (iii) continuous monitoring; and (iv) testing/evaluation of the ","2","147","1"
"CA-3","3","0","Information System Connections","The organization: Authorizes connections from the information system to other information systems outside of the authorization boundary through the use of Interconnection Security Agreements; Documents, for each connection, the interface characteristics, ","This control applies to dedicated connections between information systems and does not apply to transitory, user-controlled connections such as email and website browsing. The organization carefully considers the risks that may be introduced when informat","1","150","1"
"CA-4","0","1","Security Certification"," Withdrawn: Incorporated into CA-2 ].",\N,\N,"153","1"
"CA-5","3","0","Plan of Action and Milestones","The organization: Develops a plan of action and milestones for the information system to document the organizations planned remedial actions to correct weaknesses or deficiencies noted during the assessment of the security controls and to reduce or elimin","The plan of action and milestones is a key document in the security authorization package and is subject to federal reporting requirements established by OMB. Related control: PM-4.","3","154","1"
"CA-6","3","0","Security Authorization","The organization: Assigns a senior-level executive or manager to the role of authorizing official for the information system; Ensures that the authorizing official authorizes the information system for processing before commencing operations; and Updates ","Security authorization is the official management decision, conveyed through the authorization decision document, given by a senior organizational official or executive (i.e., authorizing official) to authorize operation of an information system and to ex","3","156","1"
"CA-7","3","0","Continuous Monitoring","The organization establishes a continuous monitoring strategy and implements a continuous monitoring program that includes: A configuration management process for the information system and its constituent components; A determination of the security impac","A continuous monitoring program allows an organization to maintain the security authorization of an information system over time in a highly dynamic environment of operation with changing threats, vulnerabilities, technologies, and missions/business proce","3","157","1"
"CM-1","3","0","Configuration Management Policy and Procedures","The organization develops, disseminates, and reviews/updates [ Assignment: organization-defined frequency ]: A formal, documented configuration management policy that addresses purpose, scope, roles, responsibilities, management commitment, coordination a","This control is intended to produce the policy and procedures that are required for the effective implementation of selected security controls and control enhancements in the configuration management family. The policy and procedures are consistent with a","1","160","1"
"CM-2","3","0","Baseline Configuration","The organization develops, documents, and maintains under configuration control, a current baseline configuration of the information system.","This control establishes a baseline configuration for the information system and its constituent components including communications and connectivity-related aspects of the system. The baseline configuration provides information about the components of an","1","161","1"
"CM-3","2","0","Configuration Change Control","The organization: Determines the types of changes to the information system that are configuration controlled; Approves configuration-controlled changes to the system with explicit consideration for security impact analyses; Documents approved configurati","The organization determines the types of changes to the information system that are configuration controlled. Configuration change control for the information system involves the systematic proposal, justification, implementation, test/evaluation, review,","1","168","1"
"CM-4","3","0","Security Impact Analysis","The organization analyzes changes to the information system to determine potential security impacts prior to change implementation.","Security impact analyses are conducted by organizational personnel with information security responsibilities, including for example, Information System Administrators, Information System Security Officers, Information System Security Managers, and Inform","2","173","1"
