"CM-5","2","0","Access Restrictions for Change","The organization defines, documents, approves, and enforces physical and logical access restrictions associated with changes to the information system.","Any changes to the hardware, software, and/or firmware components of the information system can potentially have significant effects on the overall security of the system. Accordingly, only qualified and authorized individuals are allowed to obtain access","1","176","1"
"CM-6","3","0","Configuration Settings","The organization: Establishes and documents mandatory configuration settings for information technology products employed within the information system using [ Assignment: organization-defined security configuration checklists ] that reflect the most rest","Configuration settings are the configurable security-related parameters of information technology products that are part of the information system. Security-related parameters are those parameters impacting the security state of the system including param","1","184","1"
"CM-7","3","0","Least Functionality","The organization configures the information system to provide only essential capabilities and specifically prohibits or restricts the use of the following functions, ports, protocols, and/or services: [ Assignment: organization-defined list of prohibited ","Information systems are capable of providing a wide variety of functions and services. Some of the functions and services, provided by default, may not be necessary to support essential organizational operations (e.g., key missions, functions). Additional","1","189","1"
"CM-8","3","0","Information System Component Inventory","The organization develops, documents, and maintains an inventory of information system components that: Accurately reflects the current information system; Is consistent with the authorization boundary of the information system; Is at the level of granula","Information deemed to be necessary by the organization to achieve effective property accountability can include, for example, hardware inventory specifications (manufacturer, type, model, serial number, physical location), software license information, in","1","193","1"
"CM-9","2","0","Configuration Management Plan","The organization develops, documents, and implements a configuration management plan for the information system that: Addresses roles, responsibilities, and configuration management processes and procedures; Defines the configuration items for the informa","Configuration items are the information system items (hardware, software, firmware, and documentation) to be configuration managed. The configuration management plan satisfies the requirements in the organizations configuration management policy while bei","1","200","1"
"CP-1","3","0","Contingency Planning Policy and Procedures","The organization develops, disseminates, and reviews/updates [ Assignment: organization-defined frequency ]: A formal, documented contingency planning policy that addresses purpose, scope, roles, responsibilities, management commitment, coordination among","This control is intended to produce the policy and procedures that are required for the effective implementation of selected security controls and control enhancements in the contingency planning family. The policy and procedures are consistent with appli","1","202","1"
"CP-2","3","0","Contingency Plan","The organization: Develops a contingency plan for the information system that: Identifies essential missions and business functions and associated contingency requirements; Provides recovery objectives, restoration priorities, and metrics; Addresses conti","Contingency planning for information systems is part of an overall organizational program for achieving continuity of operations for mission/business operations. Contingency planning addresses both information system restoration and implementation of alte","1","203","1"
"CP-3","3","0","Contingency Training","The organization trains personnel in their contingency roles and responsibilities with respect to the information system and provides refresher training [ Assignment: organization-defined frequency ].","None.","2","210","1"
"CP-4","3","0","Contingency Plan Testing and Exercises","The organization: Tests and/or exercises the contingency plan for the information system [ Assignment: organization-defined frequency ] using [ Assignment: organization-defined tests and/or exercises ] to determine the plans effectiveness and the organiza","There are several methods for testing and/or exercising contingency plans to identify potential weaknesses (e.g., checklist, walk-through/tabletop, simulation: parallel, full interrupt). Contingency plan testing and/or exercises include a determination of","2","213","1"
"CP-5","0","1","Contingency Plan Update","Withdrawn: Incorporated into CP-2 ].",\N,\N,"218","1"
"CP-6","2","0","Alternate Storage Site","The organization establishes an alternate storage site including necessary agreements to permit the storage and recovery of information system backup information.","Related controls: CP-2, CP-9, MP-4.","1","219","1"
"CP-7","2","0","Alternate Processing Site","The organization: Establishes an alternate processing site including necessary agreements to permit the resumption of information system operations for essential missions and business functions within [ Assignment: organization-defined time period consist","Related control: CP-2.","1","223","1"
"CP-8","2","0","Telecommunications Services","The organization establishes alternate telecommunications services including necessary agreements to permit the resumption of information system operations for essential missions and business functions within [ Assignment: organization-defined time period","Related control: CP-2.","1","229","1"
"CP-9","3","0","Information System Backup","The organization: Conducts backups of user-level information contained in the information system [ Assignment: organization-defined frequency consistent with recovery time and recovery point objectives ]; Conducts backups of system-level information conta","System-level information includes, for example, system-state information, operating system and application software, and licenses. Digital signatures and cryptographic hashes are examples of mechanisms that can be employed by organizations to protect the ","1","234","1"
"CP-10","3","0","Information System Recovery and Reconstitution","The organization provides for the recovery and reconstitution of the information system to a known state after a disruption, compromise, or failure.","Recovery is executing information system contingency plan activities to restore essential missions and business functions. Reconstitution takes place following recovery and includes activities for returning the information system to its original functiona","1","241","1"
"IA-1","3","0","Identification and Authentication Policy and Procedures","The organization develops, disseminates, and reviews/updates [ Assignment: organization-defined frequency ]: A formal, documented identification and authentication policy that addresses purpose, scope, roles, responsibilities, management commitment, coord","This control is intended to produce the policy and procedures that are required for the effective implementation of selected security controls and control enhancements in the identification and authentication family. The policy and procedures are consiste","1","248","1"
"IA-2","3","0","Identification and Authentication (Organizational Users)","The information system uniquely identifies and authenticates organizational users (or processes acting on behalf of organizational users).","Organizational users include organizational employees or individuals the organization deems to have equivalent status of employees (e.g., contractors, guest researchers, individuals from allied nations). Users are uniquely identified and authenticated for","1","249","1"
"IA-3","2","0","Device Identification and Authentication","The information system uniquely identifies and authenticates [ Assignment: organization-defined list of specific and/or types of devices ] before establishing a connection.","The devices requiring unique identification and authentication may be defined by type, by specific device, or by a combination of type and device as deemed appropriate by the organization. The information system typically uses either shared known informat","1","259","1"
"IA-4","3","0","Identifier Management","The organization manages information system identifiers for users and devices by: Receiving authorization from a designated organizational official to assign a user or device identifier; Selecting an identifier that uniquely identifies an individual or de","Common device identifiers include media access control (MAC) or Internet protocol (IP) addresses, or device-unique token identifiers. Management of user identifiers is not applicable to shared information system accounts (e.g., guest and anonymous account","1","263","1"
"IA-5","3","0","Authenticator Management","The organization manages information system authenticators for users and devices by: Verifying, as part of the initial authenticator distribution, the identity of the individual and/or device receiving the authenticator; Establishing initial authenticator","User authenticators include, for example, passwords, tokens, biometrics, PKI certificates, and key cards. Initial authenticator content is the actual content (e.g., the initial password) as opposed to requirements about authenticator content (e.g., minimu","1","269","1"
"IA-6","3","0","Authenticator Feedback","The information system obscures feedback of authentication information during the authentication process to protect the information from possible exploitation/use by unauthorized individuals.","The feedback from the information system does not provide information that would allow an unauthorized user to compromise the authentication mechanism. Displaying asterisks when a user types in a password, is an example of obscuring feedback of authentica","1","278","1"
"IA-7","3","0","Cryptographic Module Authentication","The information system uses mechanisms for authentication to a cryptographic module that meet the requirements of applicable federal laws, Executive Orders, directives, policies, regulations, standards, and guidance for such authentication.","None.","1","279","1"
"IA-8","3","0","Identification and Authentication (Non-organizational Users)","The information system uniquely identifies and authenticates non-organizational users (or processes acting on behalf of non-organizational users).","Non-organizational users include all information system users other than organizational users explicitly covered by IA-2. Users are uniquely identified and authenticated for all accesses other than those accesses explicitly identified and documented by th","1","280","1"
"IR-1","3","0","Incident Response Policy and Procedures","The organization develops, disseminates, and reviews/updates [ Assignment: organization-defined frequency ]: A formal, documented incident response policy that addresses purpose, scope, roles, responsibilities, management commitment, coordination among or","This control is intended to produce the policy and procedures that are required for the effective implementation of selected security controls and control enhancements in the incident response family. The policy and procedures are consistent with applicab","1","281","1"
"IR-2","3","0","Incident Response Training","The organization: Trains personnel in their incident response roles and responsibilities with respect to the information system; and Provides refresher training [ Assignment: organization-defined frequency ].","Incident response training includes user training in the identification and reporting of suspicious activities, both from external and internal sources. Related control: AT-3.","2","282","1"
"IR-3","2","0","Incident Response Testing and Exercises","The organization tests and/or exercises the incident response capability for the information system [ Assignment: organization-defined frequency ] using [ Assignment: organization-defined tests and/or exercises ] to determine the incident response effecti","None.","2","285","1"
"IR-4","3","0","Incident Handling","The organization: Implements an incident handling capability for security incidents that includes preparation, detection and analysis, containment, eradication, and recovery; Coordinates incident handling activities with contingency planning activities; a","Incident-related information can be obtained from a variety of sources including, but not limited to, audit monitoring, network monitoring, physical access monitoring, and user/administrator reports. Related controls: AU-6, CP-2, IR-2, IR-3, PE-6, SC-5, S","1","287","1"
"IR-5","3","0","Incident Monitoring","The organization tracks and documents information system security incidents.","Documenting information system security incidents includes, for example, maintaining records about each incident, the status of the incident, and other pertinent information necessary for forensics, evaluating incident details, trends, and handling. Incid","1","293","1"
"IR-6","3","0","Incident Reporting","The organization: Requires personnel to report suspected security incidents to the organizational incident response capability within [ Assignment: organization-defined time-period ]; and Reports security incident information to designated authorities.","The intent of this control is to address both specific incident reporting requirements within an organization and the formal incident reporting requirements for federal agencies and their subordinate organizations. The types of security incidents reported","1","295","1"
"IR-7","3","0","Incident Response Assistance","The organization provides an incident response support resource, integral to the organizational incident response capability, that offers advice and assistance to users of the information system for the handling and reporting of security incidents.","Possible implementations of incident response support resources in an organization include a help desk or an assistance group and access to forensics services, when required. Related controls: IR-4, IR-6.","3","298","1"
"IR-8","3","0","Incident Response Plan","The organization: Develops an incident response plan that: Provides the organization with a roadmap for implementing its incident response capability; Describes the structure and organization of the incident response capability; Provides a high-level appr","It is important that organizations have a formal, focused, and coordinated approach to responding to incidents. The organizations mission, strategies, and goals for incident response help determine the structure of its incident response capability.","1","301","1"
"MA-1","3","0","System Maintenance Policy and Procedures","The organization develops, disseminates, and reviews/updates [ Assignment: organization-defined frequency ]: A formal, documented information system maintenance policy that addresses purpose, scope, roles, responsibilities, management commitment, coordina","This control is intended to produce the policy and procedures that are required for the effective implementation of selected security controls and control enhancements in the system maintenance family. The policy and procedures are consistent with applica","1","302","1"
"MA-2","3","0","Controlled Maintenance","The organization: Schedules, performs, documents, and reviews records of maintenance and repairs on information system components in accordance with manufacturer or vendor specifications and/or organizational requirements; Controls all maintenance activit","The control is intended to address the information security aspects of the organizations information system maintenance program. Related controls: MP-6, SI-2.","2","303","1"
"MA-3","2","0","Maintenance Tools","The organization approves, controls, monitors the use of, and maintains on an ongoing basis, information system maintenance tools.","The intent of this control is to address the security-related issues arising from the hardware and software brought into the information system specifically for diagnostic and repair actions (e.g., a hardware or software packet sniffer that is introduced ","2","306","1"
"MA-4","3","0","Non-local Maintenance","The organization: Authorizes, monitors, and controls non-local maintenance and diagnostic activities; Allows the use of non-local maintenance and diagnostic tools only as consistent with organizational policy and documented in the security plan for the in","Non-local maintenance and diagnostic activities are those activities conducted by individuals communicating through a network; either an external network (e.g., the Internet) or an internal network. Local maintenance and diagnostic activities are those ac","1","311","1"
"MA-5","3","0","Maintenance Personnel","The organization: Establishes a process for maintenance personnel authorization and maintains a current list of authorized maintenance organizations or personnel; and Ensures that personnel performing maintenance on the information system have required ac","Individuals not previously identified in the information system, such as vendor personnel and consultants, may legitimately require privileged access to the system, for example, when required to conduct maintenance or diagnostic activities with little or ","1","319","1"
"MA-6","2","0","Timely Maintenance","The organization obtains maintenance support and/or spare parts for [ Assignment: organization-defined list of security-critical information system components and/or key information technology components ] within [ Assignment: organization-defined time pe","The organization specifies those information system components that, when not operational, result in increased risk to organizations, individuals, or the Nation because the security functionality intended by that component is not being provided. Security-","1","324","1"
"MP-1","3","0","Media Protection Policy and Procedures","The organization develops, disseminates, and reviews/updates [ Assignment: organization-defined frequency ]: A formal, documented media protection policy that addresses purpose, scope, roles, responsibilities, management commitment, coordination among org","This control is intended to produce the policy and procedures that are required for the effective implementation of selected security controls and control enhancements in the media protection family. The policy and procedures are consistent with applicabl","1","325","1"
"MP-2","3","0","Media Access","The organization restricts access to [ Assignment: organization-defined types of digital and non-digital media ] to [ Assignment: organization-defined list of authorized individuals ] using [ Assignment: organization-defined security measures ].","Information system media includes both digital media (e.g., diskettes, magnetic tapes, external/removable hard drives, flash/thumb drives, compact disks, digital video disks) and non-digital media (e.g., paper, microfilm). This control also applies to mob","1","326","1"
"MP-3","2","0","Media Marking","The organization: Marks, in accordance with organizational policies and procedures, removable information system media and information system output indicating the distribution limitations, handling caveats, and applicable security markings (if any) of th","The term marking is used when referring to the application or use of human-readable security attributes. The term labeling is used when referring to the application or use of security attributes with regard to internal data structures within the informati","1","329","1"
"MP-4","2","0","Media Storage","The organization: Physically controls and securely stores [ Assignment: organization-defined types of digital and non-digital media ] within [ Assignment: organization-defined controlled areas ] using [ Assignment: organization-defined security measures ]","Information system media includes both digital media (e.g., diskettes, magnetic tapes, external/removable hard drives, flash/thumb drives, compact disks, digital video disks) and non-digital media (e.g., paper, microfilm). This control also applies to mob","1","330","1"
"MP-5","2","0","Media Transport","The organization: Protects and controls [ Assignment: organization-defined types of digital and non-digital media ] during transport outside of controlled areas using [ Assignment: organization-defined security measures ]; Maintains accountability for inf","Information system media includes both digital media (e.g., diskettes, magnetic tapes, removable hard drives, flash/thumb drives, compact disks, digital video disks) and non-digital media (e.g., paper, microfilm). This control also applies to mobile compu","1","332","1"
"MP-6","3","0","Media Sanitization","The organization: Sanitizes information system media, both digital and non-digital, prior to disposal, release out of organizational control, or release for reuse; and Employs sanitization mechanisms with strength and integrity commensurate with the class","This control applies to all media subject to disposal or reuse, whether or not considered removable. Sanitization is the process used to remove information from information system media such that there is reasonable assurance that the information cannot b","1","337","1"
"PE-1","3","0","Physical and Environmental Protection Policy and Procedures","The organization develops, disseminates, and reviews/updates [ Assignment: organization-defined frequency ]: A formal, documented physical and environmental protection policy that addresses purpose, scope, roles, responsibilities, management commitment, c","This control is intended to produce the policy and procedures that are required for the effective implementation of selected security controls and control enhancements in the physical and environmental protection family. The policy and procedures are cons","1","344","1"
"PE-2","3","0","Physical Access Authorizations","The organization: Develops and keeps current a list of personnel with authorized access to the facility where the information system resides (except for those areas within the facility officially designated as publicly accessible); Issues authorization cr","Authorization credentials include, for example, badges, identification cards, and smart cards. Related control: PE-3, PE-4.","1","345","1"
"PE-3","3","0","Physical Access Control","The organization: Enforces physical access authorizations for all physical access points (including designated entry/exit points) to the facility where the information system resides (excluding those areas within the facility officially designated as publ","The organization determines the types of guards needed, for example, professional physical security staff or other personnel such as administrative staff or information system users, as deemed appropriate. Physical access devices include, for example, key","1","349","1"
"PE-4","2","0","Access Control for Transmission Medium","The organization controls physical access to information system distribution and transmission lines within organizational facilities.","Physical protections applied to information system distribution and transmission lines help prevent accidental damage, disruption, and physical tampering. Additionally, physical protections are necessary to help prevent eavesdropping or in transit modific","1","356","1"
"PE-5","2","0","Access Control for Output Devices","The organization controls physical access to information system output devices to prevent unauthorized individuals from obtaining the output.","Monitors, printers, and audio devices are examples of information system output devices.","1","357","1"
"PE-6","3","0","Monitoring Physical Access","The organization: Monitors physical access to the information system to detect and respond to physical security incidents; Reviews physical access logs [ Assignment: organization-defined frequency ]; and Coordinates results of reviews and investigations w","Investigation of and response to detected physical security incidents, including apparent security violations or suspicious physical access activities, are part of the organizations incident response capability.","1","358","1"
"PE-7","3","0","Visitor Control","The organization controls physical access to the information system by authenticating visitors before authorizing access to the facility where the information system resides other than areas designated as publicly accessible.","Individuals (to include organizational employees, contract personnel, and others) with permanent authorization credentials for the facility are not considered visitors.","1","361","1"
"PE-8","3","0","Access Records","The organization: Maintains visitor access records to the facility where the information system resides (except for those areas within the facility officially designated as publicly accessible); and Reviews visitor access records [ Assignment: organizatio","Visitor access records include, for example, name/organization of the person visiting, signature of the visitor, form(s) of identification, date of access, time of entry and departure, purpose of visit, and name/organization of person visited.","3","362","1"
"PE-9","2","0","Power Equipment and Power Cabling","The organization protects power equipment and power cabling for the information system from damage and destruction.","This control, to include any enhancements specified, may be satisfied by similar requirements fulfilled by another organizational entity other than the information security program. Organizations avoid duplicating actions already covered.","1","365","1"
